[
  {
    "name": "Anguila aérea",
    "role": "Secuaz de rango 1 · Animal Mediano",
    "rango": "1",
    "rol": "Secuaz",
    "tipo": "Animal",
    "attrs": {
      "fis": [
        [
          "fue",
          "2"
        ],
        [
          "def",
          "15"
        ],
        [
          "vel",
          "3"
        ]
      ],
      "cog": [
        [
          "int",
          "0"
        ],
        [
          "def",
          "11"
        ],
        [
          "vol",
          "1"
        ]
      ],
      "esp": [
        [
          "dis",
          "3"
        ],
        [
          "def",
          "13"
        ],
        [
          "pre",
          "0"
        ]
      ]
    },
    "vitals": [
      [
        "Salud",
        "12 (9–15)"
      ],
      [
        "Concentración",
        "3"
      ],
      [
        "Investidura",
        "0"
      ]
    ],
    "lines": [
      [
        "Movimiento",
        "3 m · volar 9 m · nadar 12 m"
      ],
      [
        "Sentidos",
        "6 m (vista)"
      ],
      [
        "Hab. físicas",
        "Agilidad +4, Sigilo +4"
      ],
      [
        "Hab. espirituales",
        "Percepción +5, Supervivencia +4"
      ],
      [
        "Idiomas",
        "ninguno"
      ]
    ],
    "rasgos": [
      [
        "Sentidos mejorados",
        "Ventaja en pruebas basadas en la vista que no son ataques."
      ],
      [
        "Secuaz",
        "Derrotada de inmediato al sufrir una lesión; sus ataques no provocan impactos críticos."
      ],
      [
        "Resbaladiza",
        "No provoca Acometidas reactivas mientras nada."
      ]
    ],
    "acciones": [
      [
        "1",
        "Mordisco",
        null,
        "Ataque +4, cercanía 1,5 m, un objetivo. Rasguño 2 (1d4) laceración. Impacto 6 (1d4+4) laceración; si el objetivo es Mediano o menor, gasta 1 concentración para envolverlo: queda Retenido y la anguila se aferra (no puede Morder a otro hasta soltarlo). Como 1 acción, el Retenido o alguien a ≤1,5 m la obliga a soltar con Atletismo CD 12."
      ],
      [
        "2",
        "Bomba en picado",
        null,
        "Vuela hasta 18 m hacia un objetivo en tierra que pueda sentir y usa Mordisco con ventaja. Después no puede volar hasta el final de la escena."
      ]
    ],
    "tactics": "Permanece en vuelo y oculta hasta elegir objetivo. Entonces usa Bomba en picado para morder y sujetar a su presa.",
    "oyc": null
  },
  {
    "name": "Anguila aérea mayor",
    "role": "Rival de rango 1 · Animal Mediano",
    "rango": "1",
    "rol": "Rival",
    "tipo": "Animal",
    "attrs": {
      "fis": [
        [
          "fue",
          "3"
        ],
        [
          "def",
          "16"
        ],
        [
          "vel",
          "3"
        ]
      ],
      "cog": [
        [
          "int",
          "0"
        ],
        [
          "def",
          "11"
        ],
        [
          "vol",
          "1"
        ]
      ],
      "esp": [
        [
          "dis",
          "3"
        ],
        [
          "def",
          "13"
        ],
        [
          "pre",
          "0"
        ]
      ]
    },
    "vitals": [
      [
        "Salud",
        "24 (19–29)"
      ],
      [
        "Concentración",
        "3"
      ],
      [
        "Investidura",
        "0"
      ]
    ],
    "lines": [
      [
        "Movimiento",
        "3 m · volar 9 m · nadar 12 m"
      ],
      [
        "Sentidos",
        "6 m (vista)"
      ],
      [
        "Hab. físicas",
        "Agilidad +5, Atletismo +3, Sigilo +4"
      ],
      [
        "Hab. espirituales",
        "Percepción +5, Supervivencia +4"
      ],
      [
        "Idiomas",
        "ninguno"
      ]
    ],
    "rasgos": [
      [
        "Sentidos aumentados",
        "Ventaja en pruebas basadas en la vista que no son ataques."
      ],
      [
        "Resbaladiza",
        "No provoca Acometidas reactivas mientras nada."
      ]
    ],
    "acciones": [
      [
        "1",
        "Mordisco",
        null,
        "Ataque +5, cercanía 1,5 m, un objetivo. Rasguño 3 (1d6) laceración. Impacto 9 (1d8+5) laceración; si el objetivo es Mediano o menor, gasta 1 concentración para envolverlo: queda Retenido. Como 1 acción, el Retenido o alguien a ≤1,5 m la obliga a soltar con Atletismo CD 14."
      ],
      [
        "2",
        "Bomba en picado",
        null,
        "Vuela hasta 18 m hacia un objetivo en tierra sin activar Acometidas reactivas y usa Mordisco con ventaja. Después no puede volar hasta el final de la escena."
      ],
      [
        "3",
        "Constreñir",
        null,
        "Estruja a un enemigo al que tiene Retenido, infligiendo 15 (3d6+5) de golpe."
      ]
    ],
    "tactics": "En el raro caso de atacar a un objetivo grande, usa Bomba en picado y luego Constreñir contra su presa Retenida.",
    "oyc": null
  },
  {
    "name": "Arquero",
    "role": "Secuaz de rango 1 · Humanoide Mediano",
    "rango": "1",
    "rol": "Secuaz",
    "tipo": "Humanoide",
    "attrs": {
      "fis": [
        [
          "fue",
          "2"
        ],
        [
          "def",
          "13"
        ],
        [
          "vel",
          "1"
        ]
      ],
      "cog": [
        [
          "int",
          "2"
        ],
        [
          "def",
          "13"
        ],
        [
          "vol",
          "1"
        ]
      ],
      "esp": [
        [
          "dis",
          "2"
        ],
        [
          "def",
          "13"
        ],
        [
          "pre",
          "1"
        ]
      ]
    },
    "vitals": [
      [
        "Salud",
        "12 (9–15)"
      ],
      [
        "Concentración",
        "3"
      ],
      [
        "Investidura",
        "0"
      ],
      [
        "Desvío",
        "1 (cuero)"
      ]
    ],
    "lines": [
      [
        "Movimiento",
        "7,5 m"
      ],
      [
        "Sentidos",
        "3 m (vista)"
      ],
      [
        "Hab. físicas",
        "Agilidad +3, Armamento ligero +3, Armamento pesado +4"
      ],
      [
        "Hab. cognitivas",
        "Disciplina +3"
      ],
      [
        "Hab. espirituales",
        "Percepción +4, Supervivencia +3"
      ],
      [
        "Idiomas",
        "según la cultura"
      ]
    ],
    "rasgos": [
      [
        "Secuaz",
        "Derrotado de inmediato al sufrir una lesión; sus ataques no provocan impactos críticos."
      ]
    ],
    "acciones": [
      [
        "1",
        "Acometida: Cuchillo",
        null,
        "Ataque +3, cercanía 1,5 m, un objetivo. Rasguño 2 (1d4) laceración. Impacto 5 (1d4+3) laceración."
      ],
      [
        "1",
        "Acometida: Arco largo",
        null,
        "Ataque +4, alcance 45/180 m, un objetivo. Rasguño 3 (1d6) laceración. Impacto 7 (1d6+4) laceración."
      ],
      [
        "0",
        "Apuntar",
        null,
        "En su primer turno de cada escena, si no está Sorprendido, usa Obtener ventaja como acción gratuita."
      ],
      [
        "R",
        "Disparo paralizante",
        "1 concentración",
        "Si un enemigo que pueda sentir se mueve a menos de 45 m, sufre un ataque de Arco largo. Si impacta, queda Inmovilizado hasta el final del siguiente turno del arquero."
      ]
    ],
    "tactics": "Combate a distancia: usa Disparo paralizante para conseguir superioridad y luego sigue con el Arco largo.",
    "oyc": null
  },
  {
    "name": "Axies, el Coleccionista",
    "role": "Rival de rango 3 · Humanoide Mediano",
    "rango": "3",
    "rol": "Rival",
    "tipo": "Humanoide",
    "attrs": {
      "fis": [
        [
          "fue",
          "3"
        ],
        [
          "def",
          "17"
        ],
        [
          "vel",
          "4"
        ]
      ],
      "cog": [
        [
          "int",
          "6"
        ],
        [
          "def",
          "20"
        ],
        [
          "vol",
          "4"
        ]
      ],
      "esp": [
        [
          "dis",
          "6"
        ],
        [
          "def",
          "19"
        ],
        [
          "pre",
          "3"
        ]
      ]
    },
    "vitals": [
      [
        "Salud",
        "60 (40–72)"
      ],
      [
        "Concentración",
        "6"
      ],
      [
        "Investidura",
        "0"
      ]
    ],
    "lines": [
      [
        "Movimiento",
        "9 m"
      ],
      [
        "Inmunidades",
        "Afligido, Agotado, Aturdido, Inconsciente"
      ],
      [
        "Sentidos",
        "15 m (vista)"
      ],
      [
        "Hab. físicas",
        "Agilidad +6, Hurto +8, Sigilo +8"
      ],
      [
        "Hab. cognitivas",
        "Deducción +8, Disciplina +5, Saber +10"
      ],
      [
        "Hab. espirituales",
        "Engaño +5, Percepción +10, Perspicacia +10"
      ],
      [
        "Idiomas",
        "todos"
      ]
    ],
    "rasgos": [
      [
        "Inmortal",
        "No puede morir por envejecimiento, causas naturales ni lesiones físicas. Si su salud llega a 0, no sufre lesiones y recupera 20 (5d8) al inicio de su siguiente turno."
      ],
      [
        "Maldición de la amabilidad",
        "Debe subir la apuesta en pruebas arriesgadas o difíciles, y sufre desventaja en todas las tiradas del dado de trama."
      ]
    ],
    "acciones": [
      [
        "1",
        "Acometida: Sin armas",
        null,
        "Ataque +3, cercanía 1,5 m, un objetivo. Rasguño 2 (1d4) golpe. Impacto 5 (1d4+3) golpe."
      ],
      [
        "1",
        "Dato curioso",
        "1 concentración",
        "Elige un aliado a ≤6 m, prueba de Saber CD 15 subiendo la apuesta. Si la supera, el aliado gana 2 concentración. Con O, su siguiente prueba tiene ventaja; con C, desventaja."
      ],
      [
        "2",
        "Cambiar de forma",
        "1 concentración",
        "Cambia sus rasgos para ocultar su identidad. Las pruebas para ver a través del disfraz sufren desventaja. Termina cuando él lo decide o su concentración llega a 0."
      ]